File,Text,Filtered Text,Sentiment,Rating
Recording (11).wav,mike check mike check you know I want to meet her yesterday we spoke so much my heart was an elevated state it felt so good talking to her and meeting,mike check mike check you know I want to meet her yesterday we spoke so much my heart was an elevated state it felt so good talking to her and meeting,happy,5.0
sample_Recording.wav,hello everyone my name is Sumit I am from,hello everyone my name is Sumit I am from,normal,5.0
sample_Recording_2.wav,Bhaskar news kaun bolata hai,Bhaskar news kaun bolata hai,normal,5.0
sample_Recording_3.wav,now Sumit aahe,now Sumit aahe,normal,5.0
sample_Recording_4.wav,hello I check my check Maza now Sumedha hai,hello I check my check Maza now Sumedha hai,normal,5.0
sample_Recording_5.wav,mike check Maza now Sumit aahe,mike check Maza now Sumit aahe,normal,5.0
sample_Recording_7.wav,check mike check 123 Shivam fuck off,check mike check 123 Shivam ****,angry,4.5
